{
  "schema_version": "1.0.0",
  "run_id": "run_01J9ZQ8M3K4V7B2C5D6E8F0GHJ",
  "video": {
    "sha256": "c4a1f7e2b9d053816a2e4c6f8b0d1e3a5c7f9b2d4e6a8c0f1b3d5e7a9c2f4b6d",
    "duration_s": 92.4,
    "analysis_fps": 15,
    "width": 1280,
    "height": 720,
    "frame_count": 1386
  },
  "tracks": [
    {
      "id": "trk_001",
      "concept": "hand",
      "first_t": 0.0,
      "last_t": 20.0,
      "frames": [
        {
          "frame": 0,
          "t": 0.0,
          "box": [0.41, 0.52, 0.63, 0.88],
          "score": 0.94,
          "poly": [
            [0.42, 0.53],
            [0.62, 0.54],
            [0.61, 0.87],
            [0.43, 0.86]
          ]
        },
        {
          "frame": 15,
          "t": 1.0,
          "box": [0.4, 0.5, 0.64, 0.9],
          "score": 0.95,
          "poly": [
            [0.41, 0.51],
            [0.63, 0.52],
            [0.62, 0.89],
            [0.42, 0.88]
          ]
        },
        {
          "frame": 300,
          "t": 20.0,
          "box": [0.38, 0.47, 0.6, 0.84],
          "score": 0.9,
          "poly": [
            [0.39, 0.48],
            [0.59, 0.49],
            [0.58, 0.83],
            [0.4, 0.82]
          ]
        }
      ],
      "source_chunks": ["chk_01", "chk_02"]
    },
    {
      "id": "trk_002",
      "concept": "screwdriver",
      "first_t": 3.2,
      "last_t": 12.0,
      "frames": [
        {
          "frame": 48,
          "t": 3.2,
          "box": [0.55, 0.3, 0.78, 0.66],
          "score": 0.88,
          "mask": { "encoding": "polygon", "data": "0.56,0.31 0.77,0.32 0.76,0.65 0.57,0.64" }
        },
        {
          "frame": 120,
          "t": 8.0,
          "box": [0.52, 0.28, 0.75, 0.63],
          "score": 0.86,
          "mask": { "encoding": "polygon", "data": "0.53,0.29 0.74,0.3 0.73,0.62 0.54,0.61" }
        },
        {
          "frame": 180,
          "t": 12.0,
          "box": [0.5, 0.27, 0.72, 0.6],
          "score": 0.83,
          "mask": { "encoding": "polygon", "data": "0.51,0.28 0.71,0.29 0.7,0.59 0.52,0.58" }
        }
      ],
      "source_chunks": ["chk_01"]
    },
    {
      "id": "trk_003",
      "concept": "ssd",
      "first_t": 0.0,
      "last_t": 20.0,
      "frames": [
        {
          "frame": 0,
          "t": 0.0,
          "box": [0.2, 0.55, 0.45, 0.75],
          "score": 0.91,
          "poly": [
            [0.21, 0.56],
            [0.44, 0.56],
            [0.44, 0.74],
            [0.21, 0.74]
          ]
        },
        {
          "frame": 165,
          "t": 11.0,
          "box": [0.19, 0.53, 0.46, 0.77],
          "score": 0.89,
          "poly": [
            [0.2, 0.54],
            [0.45, 0.54],
            [0.45, 0.76],
            [0.2, 0.76]
          ]
        },
        {
          "frame": 300,
          "t": 20.0,
          "box": [0.24, 0.6, 0.5, 0.8],
          "score": 0.84,
          "poly": [
            [0.25, 0.61],
            [0.49, 0.61],
            [0.49, 0.79],
            [0.25, 0.79]
          ]
        }
      ],
      "source_chunks": ["chk_01", "chk_02"]
    }
  ],
  "stitching": { "fragmentation_ratio": 1.0, "merges": 1, "gaps_filled": 2 }
}
